{
  "track_id": 58,
  "track_name": "Ontology-to-Rust Component Code Generation",
  "phase": "track-closeout",
  "status": "done",
  "task_commits": [
    {
      "task": "0.1-1.3",
      "commit_sha": "e374a3b5378493eaac2459830fe494e2380bf769",
      "message": "Complete Track 58 deterministic ontology-to-Rust component codegen and generated-components integration",
      "local_gates": [
        "cargo test -p kairo-ecs-game-ontology --features codegen",
        "cargo test -p kairo-ecs-game-theory --features generated-components",
        "node scripts/validation/validate-game-theory-codegen.mjs"
      ]
    }
  ],
  "review": {
    "command": "$conductor-review 58",
    "result": "passed",
    "accepted_fixes": [
      "Verified rustfmt-clean golden fixture and generated-components integration"
    ]
  },
  "push": {
    "ref": "origin/main",
    "pushed_sha": "e374a3b5378493eaac2459830fe494e2380bf769"
  },
  "github_actions": {
    "command": "gh pr checks --watch",
    "result": "passed",
    "run_url": "https://github.com/edithatogo/kairos/pull/261"
  },
  "validation": [
    {
      "command": "node scripts/validation/validate-game-theory-codegen.mjs",
      "result": "passed",
      "notes": "Golden Rust component fixture and manifest validated"
    }
  ],
  "evidence_paths": [
    "open-game-theory-ontology/fixtures/generated/rust/game_components.rs",
    "crates/kairo-ecs-game-ontology/tests/codegen.rs",
    "crates/kairo-ecs-game-theory/tests/generated_components.rs",
    "docs/game-theory/codegen.md"
  ],
  "waivers": []
}
