{
  "track_id": 57,
  "track_name": "Open Game Theory Ontology Subrepo and Schema Ingestion",
  "phase": "track-closeout",
  "status": "done",
  "task_commits": [
    {
      "task": "0.1-1.3",
      "commit_sha": "e374a3b5378493eaac2459830fe494e2380bf769",
      "message": "Complete Track 57 open-game-theory-ontology subrepo, Turtle/JSON-LD parser, and deterministic IR normalization",
      "local_gates": [
        "cargo test -p kairo-ecs-game-ontology --all-features",
        "cargo clippy -p kairo-ecs-game-ontology --all-targets --all-features -- -D warnings"
      ]
    }
  ],
  "review": {
    "command": "$conductor-review 57",
    "result": "passed",
    "accepted_fixes": [
      "Verified Turtle and JSON-LD normalization equivalence and malformed input rejection"
    ]
  },
  "push": {
    "ref": "origin/main",
    "pushed_sha": "e374a3b5378493eaac2459830fe494e2380bf769"
  },
  "github_actions": {
    "command": "gh pr checks --watch",
    "result": "passed",
    "run_url": "https://github.com/edithatogo/kairos/pull/261"
  },
  "validation": [
    {
      "command": "cargo test -p kairo-ecs-game-ontology --all-features",
      "result": "passed",
      "notes": "All Turtle, JSON-LD, normalization, and codegen tests pass"
    }
  ],
  "evidence_paths": [
    "open-game-theory-ontology/",
    "crates/kairo-ecs-game-ontology/src/lib.rs",
    "docs/game-theory/ontology-ingestion.md"
  ],
  "waivers": []
}
